{"event_schema_version":"1.0","event_id":"event_example","event_type":"scan.completed","occurred_at":"2026-08-20T00:00:00.000Z","producer":{"name":"SCAN","version":"2.0.0"},"scan_id":"scan_example","target_id":"target_example","subject":{},"observation":{},"evidence_refs":[],"confidence":"observed","limitations":[],"deduplication_key":"dedup_example"}
